{
 "$schema": "https://json-schema.org/draft/2020-12/schema",
 "$id": "schema:event",
 "$comment": "An authored event record (ADR-019, gh #39/#40): a declarative trigger + a nested-block command list. The trigger-kind and command enums are extended wave by wave — each kind/command lands with the Kanto beat that demands it (ADR-019 §6), and the runtime VM refuses at boot any kind, command, or condition it cannot execute, so this schema and the interpreter move together. `visible` triggers are load-time QUERIES (visible_when decides a map object's visibility), never command runs; `step` dispatch is (map, cell)-indexed at load. Conditions (`visible_when`, `when`, `if.cond`) are FormulaExpr strings whose bare identifiers read story flags (1/0) and event vars, plus the engine-state vocabulary `item_<id>` (bag count), `badge_<name>`, `badge_count`, `force_bike`, `surfing`, `player_x`/`player_y` (the player's cell), `dex_owned`, and `defeated_<x>_<y>` (the trainer at home cell (x, y) on the RECORD'S map). Beat args also accept `@object:<key>` for a named map object. A `battle_end` trigger with `rerun_enter: true` re-runs the map's enter records first — pokered's EndTrainerBattle re-running the load callback, so a door opens the moment its last guard falls. `say` is a blocking dialogue page; `notice` is the one-shot non-blocking textbox (a guard's line after a push-back — the event ends without waiting for the dismissal). Text may hold {player}/{rival} placeholders; \\n is a line break, \\f a page break, as v1's text engine reads them. `beat` invokes a native Cutscene beat by name (the strangler-fig seam while wave C dissolves story beats; ceremonies stay native forever); the arg \"@npc\" resolves to the triggering NPC.",
 "type": "object",
 "required": [
  "id",
  "trigger"
 ],
 "properties": {
  "$comment": {
   "type": "string"
  },
  "id": {
   "type": "string",
   "pattern": "^event:[a-z0-9_]+$"
  },
  "trigger": {
   "type": "object",
   "required": [
    "kind",
    "map"
   ],
   "properties": {
    "kind": {
     "enum": [
      "interact",
      "visible",
      "enter",
      "step",
      "battle_end",
      "boulder_hole",
      "boulder",
      "warp"
     ]
    },
    "dest": {
     "type": "string",
     "x-ref": "map"
    },
    "at": {
     "type": "array",
     "items": {
      "$ref": "#/$defs/cell"
     }
    },
    "map": {
     "type": "string",
     "x-ref": "map"
    },
    "object": {
     "type": "string"
    },
    "visible_when": {
     "type": "string"
    },
    "when": {
     "type": "string"
    },
    "front": {
     "type": "array",
     "items": {
      "$ref": "#/$defs/cell"
     }
    },
    "cells": {
     "type": "array",
     "items": {
      "$ref": "#/$defs/cell"
     }
    },
    "region": {
     "type": "array",
     "items": {
      "type": "integer"
     },
     "minItems": 4,
     "maxItems": 4
    },
    "facing": {
     "enum": [
      "down",
      "up",
      "left",
      "right"
     ]
    },
    "consume": {
     "type": "boolean"
    },
    "rerun_enter": {
     "type": "boolean"
    }
   },
   "additionalProperties": false
  },
  "commands": {
   "$ref": "#/$defs/block"
  },
  "custom": {
   "type": "object"
  }
 },
 "additionalProperties": false,
 "$defs": {
  "cell": {
   "type": "array",
   "items": {
    "type": "integer"
   },
   "minItems": 2,
   "maxItems": 2
  },
  "block": {
   "type": "array",
   "items": {
    "anyOf": [
     {
      "type": "object",
      "required": [
       "cmd",
       "text"
      ],
      "properties": {
       "cmd": {
        "const": "say"
       },
       "text": {
        "type": "string"
       }
      },
      "additionalProperties": false
     },
     {
      "type": "object",
      "required": [
       "cmd",
       "text"
      ],
      "properties": {
       "cmd": {
        "const": "notice"
       },
       "text": {
        "type": "string"
       }
      },
      "additionalProperties": false
     },
     {
      "type": "object",
      "required": [
       "cmd",
       "cond",
       "then"
      ],
      "properties": {
       "cmd": {
        "const": "if"
       },
       "cond": {
        "type": "string"
       },
       "then": {
        "$ref": "#/$defs/block"
       },
       "else": {
        "$ref": "#/$defs/block"
       }
      },
      "additionalProperties": false
     },
     {
      "type": "object",
      "required": [
       "cmd",
       "item"
      ],
      "properties": {
       "cmd": {
        "const": "give_item"
       },
       "item": {
        "type": "string",
        "x-ref": "item"
       },
       "count": {
        "type": "integer",
        "minimum": 1
       }
      },
      "additionalProperties": false
     },
     {
      "type": "object",
      "required": [
       "cmd",
       "item"
      ],
      "properties": {
       "cmd": {
        "const": "take_item"
       },
       "item": {
        "type": "string",
        "x-ref": "item"
       }
      },
      "additionalProperties": false
     },
     {
      "type": "object",
      "required": [
       "cmd",
       "flag"
      ],
      "properties": {
       "cmd": {
        "const": "set_flag"
       },
       "flag": {
        "type": "string"
       }
      },
      "additionalProperties": false
     },
     {
      "type": "object",
      "required": [
       "cmd",
       "flag"
      ],
      "properties": {
       "cmd": {
        "const": "clear_flag"
       },
       "flag": {
        "type": "string"
       }
      },
      "additionalProperties": false
     },
     {
      "type": "object",
      "required": [
       "cmd",
       "key"
      ],
      "properties": {
       "cmd": {
        "const": "sfx"
       },
       "key": {
        "type": "string"
       }
      },
      "additionalProperties": false
     },
     {
      "type": "object",
      "required": [
       "cmd",
       "name"
      ],
      "properties": {
       "cmd": {
        "const": "beat"
       },
       "name": {
        "type": "string"
       },
       "args": {
        "type": "array",
        "items": {
         "anyOf": [
          {
           "type": "string"
          },
          {
           "type": "integer"
          },
          {
           "type": "boolean"
          }
         ]
        }
       }
      },
      "additionalProperties": false
     },
     {
      "type": "object",
      "required": [
       "cmd",
       "map"
      ],
      "properties": {
       "cmd": {
        "const": "set_last_map"
       },
       "map": {
        "type": "string",
        "x-ref": "map"
       }
      },
      "additionalProperties": false
     },
     {
      "type": "object",
      "required": [
       "cmd",
       "x",
       "y",
       "block"
      ],
      "properties": {
       "cmd": {
        "const": "set_block"
       },
       "x": {
        "type": "integer"
       },
       "y": {
        "type": "integer"
       },
       "block": {
        "type": "integer"
       }
      },
      "additionalProperties": false
     },
     {
      "type": "object",
      "required": [
       "cmd",
       "value"
      ],
      "properties": {
       "cmd": {
        "const": "set_force_bike"
       },
       "value": {
        "type": "boolean"
       }
      },
      "additionalProperties": false
     },
     {
      "type": "object",
      "required": [
       "cmd"
      ],
      "properties": {
       "cmd": {
        "const": "mount_bike"
       }
      },
      "additionalProperties": false
     },
     {
      "type": "object",
      "required": [
       "cmd"
      ],
      "properties": {
       "cmd": {
        "const": "bounce_back"
       }
      },
      "additionalProperties": false
     },
     {
      "type": "object",
      "required": [
       "cmd"
      ],
      "properties": {
       "cmd": {
        "const": "step_back_down"
       }
      },
      "additionalProperties": false
     },
     {
      "type": "object",
      "required": [
       "cmd",
       "dir"
      ],
      "properties": {
       "cmd": {
        "const": "walk_player"
       },
       "dir": {
        "enum": [
         "down",
         "up",
         "left",
         "right"
        ]
       }
      },
      "additionalProperties": false
     },
     {
      "type": "object",
      "required": [
       "cmd",
       "object",
       "dir"
      ],
      "properties": {
       "cmd": {
        "const": "face_object"
       },
       "object": {
        "type": "string"
       },
       "dir": {
        "enum": [
         "down",
         "up",
         "left",
         "right"
        ]
       }
      },
      "additionalProperties": false
     },
     {
      "type": "object",
      "required": [
       "cmd",
       "dir"
      ],
      "properties": {
       "cmd": {
        "const": "face_player"
       },
       "dir": {
        "enum": [
         "down",
         "up",
         "left",
         "right"
        ]
       }
      },
      "additionalProperties": false
     },
     {
      "type": "object",
      "required": [
       "cmd",
       "key"
      ],
      "properties": {
       "cmd": {
        "const": "play_song"
       },
       "key": {
        "type": "string"
       }
      },
      "additionalProperties": false
     },
     {
      "type": "object",
      "required": [
       "cmd",
       "frames"
      ],
      "properties": {
       "cmd": {
        "const": "wait"
       },
       "frames": {
        "type": "integer",
        "minimum": 1
       }
      },
      "additionalProperties": false
     },
     {
      "type": "object",
      "required": [
       "cmd",
       "object",
       "to"
      ],
      "properties": {
       "cmd": {
        "const": "walk_object_to"
       },
       "object": {
        "type": "string"
       },
       "to": {
        "anyOf": [
         {
          "$ref": "#/$defs/cell"
         },
         {
          "const": "player"
         }
        ]
       },
       "offset": {
        "$ref": "#/$defs/cell"
       }
      },
      "additionalProperties": false
     },
     {
      "type": "object",
      "required": [
       "cmd",
       "class",
       "party"
      ],
      "properties": {
       "cmd": {
        "const": "class_battle"
       },
       "class": {
        "type": "string"
       },
       "party": {
        "type": "integer",
        "minimum": 1
       },
       "npc": {
        "type": "string"
       },
       "no_blackout": {
        "type": "boolean"
       }
      },
      "additionalProperties": false
     },
     {
      "type": "object",
      "required": [
       "cmd"
      ],
      "properties": {
       "cmd": {
        "const": "heal_party"
       }
      },
      "additionalProperties": false
     },
     {
      "type": "object",
      "required": [
       "cmd"
      ],
      "properties": {
       "cmd": {
        "const": "vending"
       }
      },
      "additionalProperties": false
     },
     {
      "type": "object",
      "required": [
       "cmd",
       "map",
       "to"
      ],
      "properties": {
       "cmd": {
        "const": "fall_hole"
       },
       "map": {
        "type": "string",
        "x-ref": "map"
       },
       "to": {
        "$ref": "#/$defs/cell"
       }
      },
      "additionalProperties": false
     },
     {
      "type": "object",
      "required": [
       "cmd",
       "x",
       "y"
      ],
      "properties": {
       "cmd": {
        "const": "block_cell"
       },
       "x": {
        "type": "integer"
       },
       "y": {
        "type": "integer"
       }
      },
      "additionalProperties": false
     },
     {
      "type": "object",
      "required": [
       "cmd",
       "x",
       "y"
      ],
      "properties": {
       "cmd": {
        "const": "unblock_cell"
       },
       "x": {
        "type": "integer"
       },
       "y": {
        "type": "integer"
       }
      },
      "additionalProperties": false
     },
     {
      "type": "object",
      "required": [
       "cmd",
       "object"
      ],
      "properties": {
       "cmd": {
        "const": "trainer_battle"
       },
       "object": {
        "type": "string"
       }
      },
      "additionalProperties": false
     },
     {
      "type": "object",
      "required": [
       "cmd"
      ],
      "properties": {
       "cmd": {
        "const": "reset_elite4"
       }
      },
      "additionalProperties": false
     },
     {
      "type": "object",
      "required": [
       "cmd",
       "flag"
      ],
      "properties": {
       "cmd": {
        "const": "boulder_fall"
       },
       "flag": {
        "type": "string"
       }
      },
      "additionalProperties": false
     },
     {
      "type": "object",
      "required": [
       "cmd",
       "name",
       "value"
      ],
      "properties": {
       "cmd": {
        "const": "set_var"
       },
       "name": {
        "type": "string"
       },
       "value": {
        "type": "integer"
       }
      },
      "additionalProperties": false
     },
     {
      "type": "object",
      "required": [
       "cmd",
       "object"
      ],
      "properties": {
       "cmd": {
        "const": "set_npc_text"
       },
       "object": {
        "type": "string"
       },
       "battle_text": {
        "type": "string"
       },
       "end_text": {
        "type": "string"
       }
      },
      "additionalProperties": false
     },
     {
      "type": "object",
      "required": [
       "cmd",
       "object"
      ],
      "properties": {
       "cmd": {
        "const": "hide_object"
       },
       "object": {
        "type": "string"
       }
      },
      "additionalProperties": false
     },
     {
      "type": "object",
      "required": [
       "cmd",
       "object"
      ],
      "properties": {
       "cmd": {
        "const": "show_object"
       },
       "object": {
        "type": "string"
       }
      },
      "additionalProperties": false
     },
     {
      "type": "object",
      "required": [
       "cmd",
       "seats"
      ],
      "properties": {
       "cmd": {
        "const": "lucky_slot"
       },
       "seats": {
        "type": "array",
        "items": {
         "$ref": "#/$defs/cell"
        }
       }
      },
      "additionalProperties": false
     },
     {
      "type": "object",
      "required": [
       "cmd"
      ],
      "properties": {
       "cmd": {
        "const": "play_slots"
       }
      },
      "additionalProperties": false
     },
     {
      "type": "object",
      "required": [
       "cmd"
      ],
      "properties": {
       "cmd": {
        "const": "club_enter"
       }
      },
      "additionalProperties": false
     },
     {
      "type": "object",
      "required": [
       "cmd"
      ],
      "properties": {
       "cmd": {
        "const": "club_leave"
       }
      },
      "additionalProperties": false
     },
     {
      "type": "object",
      "required": [
       "cmd"
      ],
      "properties": {
       "cmd": {
        "const": "trash_reset"
       }
      },
      "additionalProperties": false
     },
     {
      "type": "object",
      "required": [
       "cmd"
      ],
      "properties": {
       "cmd": {
        "const": "trash_can"
       }
      },
      "additionalProperties": false
     },
     {
      "type": "object",
      "required": [
       "cmd",
       "dir",
       "count"
      ],
      "properties": {
       "cmd": {
        "const": "walk_forward"
       },
       "dir": {
        "enum": [
         "down",
         "up",
         "left",
         "right"
        ]
       },
       "count": {
        "type": "integer"
       }
      },
      "additionalProperties": false
     },
     {
      "type": "object",
      "required": [
       "cmd"
      ],
      "properties": {
       "cmd": {
        "const": "elevator_retarget"
       }
      },
      "additionalProperties": false
     },
     {
      "type": "object",
      "required": [
       "cmd",
       "floors"
      ],
      "properties": {
       "cmd": {
        "const": "elevator_panel"
       },
       "floors": {
        "type": "array",
        "items": {
         "type": "array",
         "prefixItems": [
          {
           "type": "string"
          },
          {
           "type": "string",
           "x-ref": "map"
          },
          {
           "type": "integer"
          }
         ],
         "minItems": 3,
         "maxItems": 3
        }
       }
      },
      "additionalProperties": false
     }
    ]
   }
  }
 }
}
