{
 "$comment": "scripts/SilphCo11F.asm GateCallbackScript — lay the floor's still-locked card-key door blocks on load (the static .blk ships them open).",
 "id": "event:silph_co11f_doors",
 "trigger": {
  "kind": "enter",
  "map": "map:SilphCo11F"
 },
 "commands": [
  {
   "cmd": "if",
   "cond": "not SILPH_DOOR_SilphCo11F_3_6",
   "then": [{"cmd": "set_block", "x": 3, "y": 6, "block": 32}]
  }
 ]
}
