{
 "$comment": "scripts/DiglettsCaveRoute2.asm — sets wLastMap = ROUTE_2 on load, so this connector's LAST_MAP exits go back to Route 2 regardless of which side you entered from (gh #114).",
 "id": "event:digletts_cave_route2_last_map",
 "trigger": {
  "kind": "enter",
  "map": "map:DiglettsCaveRoute2"
 },
 "commands": [
  {
   "cmd": "set_last_map",
   "map": "map:Route2"
  }
 ]
}
