{
 "$comment": "scripts/GameCornerPrizeRoom.asm — the right prize counter (bg_event at (6,2)): the TM counter.",
 "id": "event:prize_counter_right",
 "trigger": {
  "kind": "interact",
  "map": "map:GameCornerPrizeRoom",
  "front": [[6, 2]]
 },
 "commands": [
  {
   "cmd": "beat",
   "name": "prize_vendor",
   "args": [2]
  }
 ]
}
