{
 "$comment": "scripts/Colosseum.asm — pressing A into the table's two center cells opens the flow.",
 "id": "event:colosseum_table",
 "trigger": {
  "kind": "interact",
  "map": "map:Colosseum",
  "front": [
   [
    4,
    4
   ],
   [
    5,
    4
   ]
  ]
 },
 "commands": [
  {
   "cmd": "beat",
   "name": "colosseum_table"
  }
 ]
}
