{
 "$comment": "scripts/RocketHideoutB4F.asm RocketHideoutB4FRocket3AfterBattleText — beaten, Rocket 3 lets slip that he dropped the LIFT KEY; only once the text is dismissed does the ball turn up beside him (CheckAndSetEvent EVENT_ROCKET_DROPPED_LIFT_KEY -> ShowObject ITEM_5 at (10,2); the _shown record persists it).",
 "id": "event:rocket_hideout_b4f_lift_key",
 "trigger": {
  "kind": "interact",
  "map": "map:RocketHideoutB4F",
  "object": "SPRITE_ROCKET@11,2",
  "when": "defeated_11_2 and not ROCKET_DROPPED_LIFT_KEY"
 },
 "commands": [
  {
   "cmd": "say",
   "text": "Oh no! I dropped\nthe LIFT KEY!"
  },
  {
   "cmd": "set_flag",
   "flag": "ROCKET_DROPPED_LIFT_KEY"
  },
  {
   "cmd": "show_object",
   "object": "SPRITE_POKE_BALL@10,2"
  }
 ]
}
