{
 "$comment": "scripts/GameCorner.asm GameCornerSetRocketHideoutDoorTile — the staircase to the Rocket Hideout stays hidden (a wall, its warp cell blocked) until the poster switch is found; GameCornerSelectLuckySlotMachine re-rolls the lucky seat each visit (transient RAM-like state, the overworld RNG).",
 "id": "event:game_corner_a_enter",
 "trigger": {
  "kind": "enter",
  "map": "map:GameCorner"
 },
 "commands": [
  {
   "cmd": "if",
   "cond": "not FOUND_ROCKET_HIDEOUT",
   "then": [
    {
     "cmd": "set_block",
     "x": 8,
     "y": 2,
     "block": 42
    },
    {
     "cmd": "block_cell",
     "x": 17,
     "y": 4
    }
   ]
  },
  {
   "cmd": "lucky_slot",
   "seats": [
    [
     1,
     10
    ],
    [
     1,
     11
    ],
    [
     1,
     12
    ],
    [
     1,
     13
    ],
    [
     1,
     14
    ],
    [
     1,
     15
    ],
    [
     6,
     10
    ],
    [
     6,
     11
    ],
    [
     6,
     13
    ],
    [
     6,
     14
    ],
    [
     6,
     15
    ],
    [
     7,
     10
    ],
    [
     7,
     11
    ],
    [
     7,
     12
    ],
    [
     7,
     13
    ],
    [
     7,
     14
    ],
    [
     7,
     15
    ],
    [
     12,
     10
    ],
    [
     12,
     11
    ],
    [
     12,
     12
    ],
    [
     12,
     13
    ],
    [
     12,
     14
    ],
    [
     12,
     15
    ],
    [
     13,
     10
    ],
    [
     13,
     11
    ],
    [
     13,
     13
    ],
    [
     13,
     14
    ],
    [
     13,
     15
    ],
    [
     18,
     11
    ],
    [
     18,
     12
    ],
    [
     18,
     13
    ],
    [
     18,
     14
    ],
    [
     18,
     15
    ]
   ]
  }
 ]
}
